{
  "featVersion": "1.0",
  "schemas": { "adapter": "@mmmnt/feat-schema-json" },
  "response": {
    "adapter": "@mmmnt/feat-adapter-http",
    "invoke": { "baseUrl": "http://localhost:3000" },
    "commands": {
      "PublishOrder": { "method": "POST", "path": "/orders/{orderId}/publish" }
    }
  },
  "services": {
    "outbox": { "adapter": "feat-adapter-postgres", "consistency": "acid" },
    "eventBroker": { "adapter": "@mmmnt/feat-adapter-kafka", "consistency": "eventual", "convergenceTimeout": 3000 }
  },
  "specs": { "dir": ".", "pattern": "*.feat", "contractPattern": "*.contract.json", "outputPattern": "{name}.test.ts" },
  "report": { "format": ["console"] }
}
