{
  "featVersion": "1.0",
  "schemas": { "adapter": "@mmmnt/feat-schema-json" },
  "response": {
    "adapter": "@mmmnt/feat-adapter-handler",
    "commands": {
      "Ping": { "module": "src/ping.ts", "export": "ping" }
    }
  },
  "services": {
    "eventStore": { "adapter": "@mmmnt/feat-adapter-kurrent", "consistency": "eventual" }
  },
  "specs": { "dir": ".", "pattern": "**/*.feat", "contractPattern": "**/*.contract.json", "outputPattern": "{name}.test.ts" },
  "report": { "format": ["console"] }
}
